output	text
only-prom-con-LJ045-0096.wav	Mrs. De Mohrenschildt thought that Oswald,
only-prom-con-LJ049-0022.wav	The Secret Service believed that it was very doubtful that any President would ride regularly in a vehicle with a fixed top, even though transparent.
only-prom-con-LJ033-0042.wav	Between the hours of eight and nine p.m. they were occupied with the children in the bedrooms located at the extreme east end of the house.
only-prom-con-LJ016-0117.wav	The prisoner had nothing to deal with but wooden panels, and by dint of cutting and chopping he got both the lower panels out.
only-prom-con-LJ025-0157.wav	Under these circumstances, unnatural as they are, with proper management, the bean will thrust forth its radicle and its plumule;
only-prom-con-LJ042-0219.wav	Oswald demonstrated his thinking in connection with his return to the United States by preparing two sets of identical questions of the type which he might have thought
only-prom-con-LJ032-0164.wav	it is not possible to state with scientific certainty that a particular small group of fibers come from a certain piece of clothing
only-prom-con-LJ046-0092.wav	has confidence in the dedicated Secret Service men who are ready to lay down their lives for him
only-prom-con-LJ050-0118.wav	Since these agencies are already obliged constantly to evaluate the activities of such groups,
only-prom-con-LJ043-0016.wav	Jeanne De Mohrenschildt said, quote,
only-prom-con-LJ021-0078.wav	no economic panacea, which could simply revive over-night the heavy industries and the trades dependent upon them.
only-prom-con-LJ039-0148.wav	Examination of the cartridge cases found on the sixth floor of the Depository Building
only-prom-con-LJ023-0056.wav	It is an easy document to understand when you remember that it was called into being
only-prom-con-LJ021-0025.wav	And in many directions, the intervention of that organized control which we call government
only-prom-con-LJ030-0105.wav	Communications in the motorcade.
only-prom-con-LJ021-0012.wav	with respect to industry and business, but nearly all are agreed that private enterprise in times such as these
only-prom-con-LJ019-0169.wav	and one or two men were allowed to mend clothes and make shoes. The rules made by the Secretary of State were hung up in conspicuous parts of the prison;
only-prom-con-LJ039-0088.wav	It just is an aid in seeing in the fact that you only have the one element, the crosshair,
only-prom-con-LJ016-0192.wav	"I think I could do that sort of job," said Calcraft, on the spur of the moment.
only-prom-con-LJ014-0142.wav	was strewn in front of the dock, and sprinkled it towards the bench with a contemptuous gesture.
